{
  "userId": "usr_demo_0001",
  "metricKey": "weightKg",
  "points": [
    {
      "t": "2025-12-20",
      "v": 94.1
    },
    {
      "t": "2025-12-27",
      "v": 93.0
    },
    {
      "t": "2026-01-03",
      "v": 92.7
    },
    {
      "t": "2026-01-06",
      "v": 92.4
    }
  ],
  "computedAt": "2026-01-06T13:10:00+01:00"
}